{
  "object": "lao",
  "action": "state",
  "id": "fzJSZjKf-2cbXH7kds9H8NORuuFIRLkevJlN7qQemjo=",
  "name": "LAO",
  "creation": 1633098234,
  "last_modified": 1633099140,
  "organizer": "J9fBzJV70Jk5c-i3277Uq4CmeL4t53WDfUghaK0HpeM=",
  "witnesses": [],
  "modification_id": "jxGc3oV0aKBIhvln6NwE1ZKYM-xtlLn_DlvziL2NT74=",
  "modification_signatures": []
}